sentence1,sentence2,label
Geraldine created a wonderful and odd work of art, Geraldine didn't create a wonderful work of art,1
Allen is nice and Valerie is nice, Allen is not nice,1
Craig is poor and Maxine is careful, Maxine is not careful,1
Earl is delightful and Salvador is wonderful, Elizabeth is not inexpensive,0
Leona went to Jackie's house and wore a purple jacket,Dale didn't wear a purple jacket,0
Albert blew it and ate breakfast,Albert didn't choose this way of life,0
Ian let this happen and dug a hole in the garden,Ian didn't dig a hole in the garden,1
"Ellen, who is a vet, saw a dog chasing a cat",Ellen isn't a vet,1
Clayton is thankful and Eduardo is poor, Clayton is not poor,0
Freddie created a purple and polite work of art, Cecilia didn't create a polite work of art,0
Vera is zealous and Jeffrey is alive, Jeffrey is not zealous,0
Angela saw a girl driving Marion's car,Angela didn't saw a girl driving,1
Debbie is obedient and Keith is wrong, Keith is not obedient,0
Minnie sang a pop song and paid him,Minnie didn't teach Ramona about songwriting,0
"Derek, who is a carpenter, visit Verna","Derek, who is a builder, didn't visit Verna",0
Ricardo is hallowed and Christopher is clever, Christopher is not clever,1
Debbie threw everything out the window and lent me some money a month before,Debbie didn't throw everything out the window,1
Michael created a witty and salmon work of art, Michael didn't create a witty work of art,1
"Joan, who is a secretary, visit Joel",Joan didn't visit Joel,1
Cassandra went to Slobozia and Timisoara,Cassandra didn't go to Timisoara,1
Iris threw everything out the window and put the phone down,Jeffery didn't put the phone down,0
"Samantha, who is a cop, visit Jennie",Samantha isn't a cop,1
"Herman, who is a flight attendant, visit Dora","Herman, who is a lawyer, didn't visit Dora",0
Sarah is victorious and Mary is victorious, Ben is tender,0
Ernest is faithful and Barbara is proud, Ernest is not faithful,1
Nancy is faithful and Opal is eager, Russell is not alive,0
Cindy bet on the game and spent all my money,Carlos didn't bet on the game,0
Luis and Chester have traveled to Dej,Luis didn't travel to Reghin,0
Bernard and Tony have visited Vaslui,Tony didn't visit Vaslui,1
Gwendolyn created a fierce and jolly work of art, Gwendolyn didn't create a fierce work of art,1
Justin has visited Dej and Lugoj,Justin didn't visit Turda,0
Debbie is obedient and Dean is happy, Brittany is easy,0
Susan is proud and Lauren is victorious, Susan is not proud,1
Candace rode the horse and held him close,Candace didn't go to Curtis's house,0
Joan paid me and bent the gray rod,Joan didn't pay me,1
Willard is agreeable and Everett is wonderful, Chester is careful,0
Kay has traveled to Deva and Lugoj,Sue didn't travel to Lugoj,0
Elmer created a gifted and unsightly work of art, Elmer didn't create a gifted work of art,1
Juan is thankful and Jamie is lively, Vanessa is tender,0
"Marilyn, who is a butcher, saw the city mayor","Marilyn, who is a hairdresser, didn't saw the city mayor",0
Dana wrote a song about the sky and led me to Manuel's house,Dana didn't write a song about the sky,1
"Daniel, who is a electrician, saw a blue plane","Daniel, Stephanie's father, didn't saw a blue plane",0
Marcia and Eric have traveled to Slatina,Marcia didn't travel to Giurgiu,0
Teresa created a brave and jolly work of art, Teresa didn't create a brave work of art,1
Claire is jolly and Kelly is obedient, Claire is not jolly,1
Brandon is eager and Candice is faithful, Brandon is not eager,1
"Chris, who is a flight attendant, bought a cup of coffee","Chris, Debra's father, didn't buy a cup of coffee",0
Zachary created a fierce and chubby work of art, Zachary didn't create an elegant work of art,0
Melanie and Sandy have visited Baia Mare,Darryl didn't visit Baia Mare,0
Deborah created a handsome and careful work of art, Deborah didn't create a shy work of art,0
Lola and Naomi have visited Craiova,Katherine didn't visit Craiova,0
Jill created a handsome and rich work of art, Jill didn't create a handsome work of art,1
Inez is victorious and Beatrice is clever, Beatrice is not victorious,0
Bryan sent me a letter and grew up,Felix didn't send me a letter,0
Gregory created a famous and obedient work of art, Gregory didn't create a famous work of art,1
Monica created a shapely and thankful work of art, Brent didn't create a shapely work of art,0
Perry bet on the yellow car and sat on the floor,Cynthia didn't sit on the floor,0
Jorge has traveled to Vaslui and Lugoj,Carole didn't travel to Vaslui,0
Sonya taught middle school science and froze my account,Sonya didn't freeze my account,1
Brent created a magnificent and flabby work of art, Brent didn't create an uninterested work of art,0
Dwayne created an inexpensive and blue work of art, Dwayne didn't create an inexpensive work of art,1
Vickie and Kristine have traveled to Lugoj,Julia didn't travel to Lugoj,0
"Lynda, who is a fireman, bought a japanese novel","Lynda, who is a builder, didn't buy a japanese novel",0
Jan is calm and Bruce is helpful, Bruce is not calm,0
Jo is mushy and Veronica is mealy, Veronica is not mealy,1
Holly created a nice and silly work of art, Holly didn't create a white work of art,0
Margie has traveled to Timisoara and Turda,Alicia didn't travel to Timisoara,0
Lois is silly and Jamie is lively, Cecilia is powerful,0
Annette created a gifted and clumsy work of art, Annette didn't create a gifted work of art,1
"Michael, who is a chef, visit Victor",Michael isn't a chef,1
Jimmy threw everything out the window and drank an orange juice,Jimmy didn't drink an orange juice,1
Oscar created an important and uninterested work of art, George didn't create an important work of art,0
"Shelly, who is a hairdresser, visit Jeffrey",Shelly isn't a hairdresser,1
Roberta is lively and Kay is dead, Roberta is not dead,0
Chester has visited Giurgiu and Craiova,Chester didn't visit Mangalia,0
Arlene is alive and Eric is powerful, Eric is not powerful,1
Pauline heard Jeremy and dug a hole in the garden,Pauline didn't hear Jeremy,1
Tara took a summer job and showed my new photos,Susan didn't show my new photos,0
Louis and Clifton went to Arad,Clifton didn't go to Bucharest,0
Eduardo and Ethel have traveled to Arad,Eduardo didn't travel to Lugoj,0
Isabel created a happy and fierce work of art, Rick didn't create a fierce work of art,0
Inez created a magnificent and gray work of art, Inez didn't create a magnificent work of art,1
"Patrick, who is a musician, visit Irene","Patrick, Regina's father, didn't visit Irene",0
Craig saw Theresa driving an electric icy bicycle,Craig didn't saw Theresa driving,1
Michael is shy and Kayla is unimportant, Kayla is not unimportant,1
Linda created a pitiful and yellow work of art, Linda didn't create a pitiful work of art,1
Maria created a calm and orange work of art, Maria didn't create a calm work of art,1
Monica saw a boy driving Karen's bicycle,Monica didn't saw a boy driving Wade's new Tesla Roadster,0
Gary and Caroline have visited Arad,Derek didn't visit Arad,0
Viola and Flora have traveled to Deva,Christina didn't travel to Deva,0
Patsy created a stocky and attractive work of art, Enrique didn't create a stocky work of art,0
Kenneth is eager and Gordon is obedient, Ted is not tender,0
Marcus created a helpless and clever work of art, Marcus didn't create a green work of art,0
Rebecca created an inexpensive and purple work of art, Rebecca didn't create an inexpensive work of art,1
Pamela is shy and Sherry is gifted, Sherry is not gifted,1
Martin saw Manuel running from Flora's car,Martin didn't saw Manuel running,1
Patsy and Lucille have traveled to Mangalia,Patsy didn't travel to Mangalia,1
Alfred went to Lugoj and Lugoj,Jo didn't go to Lugoj,0
Robin created a gentle and polite work of art, Robin didn't create an uptight work of art,0
"Deanna, who is a painter, bought a japanese novel","Deanna, who is a technician, didn't buy a japanese novel",0
Anna created a bewildered and poor work of art, Anna didn't create a bewildered work of art,1
Maryann created a kind and attractive work of art, Maryann didn't create a kind work of art,1
Alan knew Jeffery's secret and sent me a letter,Peter didn't send me a letter,0
Virginia is gifted and Terrence is odd, Terrence is not odd,1
"Mark, who is a hairdresser, visit Corey",Mark didn't visit Corey,1
Irma and Becky have visited Bucharest,Irma didn't visit Hunedoara,0
Brittany and Jackie have traveled to Mangalia,Brittany didn't travel to Tulcea,0
Becky sold Rosa's house and hung up on me,Becky didn't sell Rosa's house,1
Christine and Lawrence have traveled to Bucharest,Flora didn't travel to Bucharest,0
Alison and Anita went to Cluj-Napoca,Anita didn't go to Cluj-Napoca,1
Wade saw a girl driving Leslie's bicycle,Wade didn't saw a girl driving,1
Adam is agreeable and Jerome is helpful, Jerome is not agreeable,0
"Naomi, who is a cashier, visit Curtis",Naomi isn't a cashier,1
Kevin was the first in line and drew ahead of the other runners,Joyce wasn't the first in line,0
Karen and Reginald have traveled to Giurgiu,Reginald didn't travel to Giurgiu,1
Ray spent all my money and sold me a black car,Ray didn't spend all my money,1
Antoinette and Clyde have visited Blaj,Clyde didn't visit Cluj-Napoca,0
Leon saw a boy driving a gray car,Leon didn't saw a boy driving,1
Tracy and Joyce have visited Bucharest,Isaac didn't visit Bucharest,0
Hilda and Randall have visited Giurgiu,Randall didn't visit Reghin,0
Jamie broke the record and taught Mario about songwriting,Jamie didn't break the record,1
Tracey blew me off and saw a black car running fast,Ellen didn't see a black car running fast,0
Angela created a witty and zealous work of art, Charlotte didn't create a zealous work of art,0
"Shelly, who is a builder, saw the new Tesla Roadster",Shelly didn't saw the new Tesla Roadster,1
"Geraldine, who is a vet, bought a Macbook","Geraldine, Earl's mother, didn't buy a Macbook",0
Kenneth saw a boy running from a ashy bus,Kenneth didn't saw a boy running,1
Rhonda is poor and Rita is shy, Rita is not shy,1
Stella saw a girl running from a white school bus,Stella didn't saw a girl running from a white bus,0
Zachary said nice things and cut a tree,Dawn didn't cut a tree,0
"Veronica, who is a nurse, bought a cup of coffee",Veronica isn't a nurse,1
Heather created a helpful and rich work of art, Heather didn't create a helpful work of art,1
Stephanie created a beautiful and zealous work of art, Stephanie didn't create a beautiful work of art,1
"Ann, who is a cop, visit Guadalupe",Ann didn't visit Guadalupe,1
Theodore told me everything and lost my computer,Theodore didn't say funny things,0
Howard created a repulsive and angry work of art, Howard didn't create a repulsive work of art,1
Bessie built an altar for Jeanette and shut the door down,Bessie didn't shut the door down,1
Luis went to Timisoara and Mangalia,Luis didn't go to Mangalia,1
Salvador lent me Alfredo's salmon bicycle and put the phone down,Salvador didn't blow me off,0
Lula paid Charlie and hid behind a bush,Lula didn't pay Charlie,1
Salvador has visited Bucharest and Turda,Salvador didn't visit Turda,1
Earl created a plain and dead work of art, Earl didn't create a plain work of art,1
Bernard is helpful and Francis is clever, Francis is not clever,1
"Kenneth, who is a plumber, saw the new Tesla Roadster",Kenneth isn't a plumber,1
Leslie came at midnight and hid behind a bush,Douglas didn't come at midnight,0
Daisy created a beautiful and scary work of art, Rene didn't create a scary work of art,0
Tiffany shut the door down and took the footage,Tiffany didn't take the footage,1
Francis sat on the mat and did some good work,Minnie didn't sit on the mat,0
Michele is delightful and Everett is thankful, Alma is not uninterested,0
Margaret and Sabrina have visited Reghin,Margaret didn't visit Reghin,0
Lori let this happen and paid me,Lori didn't pay me,1
Stephanie went to Bucharest and Blaj,Stephanie didn't go to Blaj,1
Marc is wonderful and Everett is calm, Lindsay is not dead,0
Kristi is calm and Milton is polite, Kristi is not calm,1
Bryan has visited Lugoj and Mangalia,Bryan didn't visit Lugoj,1
Tracey is jolly and Victoria is faithful, Tracey is not jolly,1
Karl created a lazy and bewildered work of art, Karl didn't create an embarrassed work of art,0
"Leslie, who is a journalist, visit Danny",Leslie isn't a journalist,1
Guy is polite and Sara is mealy, Sara is not polite,0
Marsha is gentle and Brenda is silly, Ted is not dead,0
Kurt went to Bucharest and Hunedoara,Kurt didn't go to Baia Mare,0
"Allan, who is a fireman, bought a Chilean wine",Allan didn't buy a Chilean wine,1
Felix is nice and Erica is silly, Felix is not nice,1
Mathew led me to Alfred's house and paid him,Ramon didn't lead me to Alfred's house,0
Rosa drew ahead of the other runners and bet on the orange car,Kent didn't bet on the orange car,0
Kent went to Cluj-Napoca and Slobozia,Tiffany didn't go to Cluj-Napoca,0
Evelyn created a helpful and polite work of art, Evelyn didn't create a helpful work of art,1
Alfred saw a girl running from a ashy bus with a new engine,Alfred didn't saw a girl running from a gray school bus,0
Chester kept saying this was crazy and rode the buffalo,Stephen didn't keep saying this was crazy,0
Amanda created a silly and grumpy work of art, Lawrence didn't create a grumpy work of art,0
"Carl, who is a chef, bought a Macbook",Carl didn't buy a Macbook,1
Amber is mealy and Lisa is mushy, Lisa is not mushy,1
Charlene has visited Lugoj and Deva,Lillie didn't visit Lugoj,0
Barbara is helpful and Emma is mealy, Emma is not mealy,1
Melody is victorious and Victoria is lively, Carole is not important,0
Wallace created a scary and jolly work of art, Wallace didn't create a victorious work of art,0
Arthur knew Hazel's secret and said nice things,Pamela didn't know Hazel's secret,0
Casey and Rhonda have visited Bucharest,Casey didn't visit Slatina,0
"Vanessa, who is a tailor, bought a cup of coffee","Vanessa, who is a engineer, didn't buy a cup of coffee",0
Kelly said funny things and lost the mango car in Dej,Luis didn't say funny things,0
Carla and Grace went to Lugoj,Carla didn't go to Lugoj,1
Tyrone saw a boy running from a yellow bus with a new engine,Tyrone didn't saw a boy running from Harvey's car,0
Jeremy saw her and spoke to her about Anthony,Jeremy didn't sleep the night,0
Alan is obedient and Felix is aggressive, Max is not inexpensive,0
Dolores created a famous and ambitious work of art, Dolores didn't create a famous work of art,1
Fernando is zealous and Karl is calm, Fernando is not zealous,1
Antoinette beat Eleanor out of 20 dollars and hid behind a bush,Russell didn't hide behind a bush,0
Vernon beat us a lot and took a summer job,Vernon didn't bet on the salmon car,0
Billie brought me out of Arthur's house and bet on the white car,Curtis didn't bet on the white car,0
Joann has visited Turda and Blaj,Joann didn't visit Blaj,1
Theresa had a green car and drew ahead of the other runners,Nancy didn't draw ahead of the other runners,0
Christopher is proud and Tyler is mealy, Tyler is not proud,0
Marion has traveled to Blaj and Bucharest,Marion didn't travel to Slobozia,0
Debbie saw a boy driving a lemon bicycle,Debbie didn't saw a boy driving,1
Carlos felt a strange and wore a red jacket,Carlos didn't wear a red jacket,1
"Carolyn, who is a musician, bought a cup of coffee","Carolyn, who is a electrician, didn't buy a cup of coffee",0
"Victor, who is a baker, visit Daryl",Victor didn't visit Daryl,1
Molly gave Kelly a green car and put Catherine in charge,Pedro didn't give Kelly a green car,0
Jodi is gentle and Elizabeth is eager, Dean is wrong,0
"Reginald, who is a technician, bought the new Tesla Roadster",Reginald didn't buy the new Tesla Roadster,1
Lee created an ugly and magnificent work of art, Jon didn't create an ugly work of art,0
Wilma and Violet have visited Blaj,Wilma didn't visit Blaj,1
Diane took office and lost Lynda's red car,Diane didn't bring me out of Grace's house,0
Mario ate a steak and sang a pop song,Mario didn't eat a steak,1
Jill created a lively and proud work of art, Jill didn't create a lively work of art,1
Beverly has traveled to Reghin and Oradea,Beverly didn't travel to Oradea,1
Sheila and Mamie went to Giurgiu,Mamie didn't go to Slatina,0
"Sherri, who is a electrician, visit Felix","Sherri, Sonia's mother, didn't visit Felix",0
Rick created a yellow and lazy work of art, Louise didn't create a yellow work of art,0
Charlie put Wayne in charge and thought Cindy was going to die,Charlie didn't think Cindy was going to die,1
Luz saw Brian running from Sarah's car,Luz didn't saw Brian running,1
Mark created an angry and victorious work of art, Mark didn't create an angry work of art,1
Julio got the money and drank a bottle of wine,Julio didn't get the money,1
Darlene has visited Bucharest and Turda,Darlene didn't visit Slobozia,0
Yvette dug a hole in the garden and left me,Norma didn't leave me,0
Clyde is better and Hazel is dead, Hazel is not dead,1
Clyde felt threatened and chose this soccer team,Clyde didn't become very important to me,0
Jimmy created a thoughtless and white work of art, Jimmy didn't create a thoughtless work of art,1
Melanie created a delightful and nervous work of art, Melanie didn't create a delightful work of art,1
Kayla and Melvin have traveled to Lugoj,Melvin didn't travel to Lugoj,1
Dale flew to Lugoj and understood what Roberto comment about Slobozia,Dale didn't fly to Lugoj,1
Joel created a flabby and scary work of art, Joel didn't create a flabby work of art,1
Francis created a delightful and thankful work of art, Francis didn't create an easy work of art,0
Lola got the money and beat her,Lola didn't get the money,1
"Brittany, who is a vet, visit Perry","Brittany, Bernice's mother, didn't visit Perry",0
Micheal left me waiting and broke the rules,Micheal didn't leave me waiting,1
"Diana, who is a hairdresser, bought a pizza","Diana, who is a musician, didn't buy a pizza",0
Lindsay is proud and Bruce is silly, Lindsay is not proud,1
"Vanessa, who is a butcher, saw the accident",Vanessa didn't saw the accident,1
Leona saw a girl running from a icy bus with a new engine,Leona didn't saw a girl running from Paul's car,0
Elsie is thankful and Gerald is silly, Jackie is not wrong,0
Pamela is polite and Micheal is delightful, Andrew is not rich,0
Hector showed my new photos and paid Antonio,Hector didn't pay Antonio,1
Allen is lively and Suzanne is lively, Allen is not lively,1
Larry is brave and Marvin is odd, Larry is not odd,0
Heidi is agreeable and Francis is clever, Heidi is not clever,0
"Stacy, who is a cleaner, visit Jim","Stacy, who is a cashier, didn't visit Jim",0
Lee created a mysterious and repulsive work of art, Lee didn't create a mysterious work of art,1
Mary created a shy and icy work of art, Mary didn't create a shy work of art,1
Dawn is witty and Angela is jolly, Charlotte is wrong,0
Jon thought I was helping Antonio and lost Clinton's blue car,Jon didn't lose Clinton's blue car,1
Philip went to Hunedoara and Timisoara,Philip didn't go to Hunedoara,1
Gina and Karen have visited Oradea,Karen didn't visit Oradea,1
Dorothy has traveled to Slatina and Bucharest,Dorothy didn't travel to Bucharest,1
Grace said nice things and froze Monica's bank account,Grace didn't say nice things,1
Darren and Chris have traveled to Lugoj,Chris didn't travel to Lugoj,1
Lori built an altar for Stacy and gave Maurice a gray shirt,Kirk didn't give Maurice a gray shirt,0
Francis is careful and Erin is mushy, Erin is not mushy,1
Nicole is poor and Gregory is helpful, Gregory is not helpful,1
Genevieve saw a boy running from Emma's car,Genevieve didn't saw a boy running from a ashy car,0
Guy and Jose have visited Reghin,Jose didn't visit Vaslui,0
Jodi took office and burned Ben's house,Steven didn't take office,0
Connie went away and hid behind a bush,Connie didn't hide behind a bush,1
Allen began crying and fought Carol,Bessie didn't fight Carol,0
Sergio created a bewildered and bald work of art, Sergio didn't create a wonderful work of art,0
"Barbara, who is a cleaner, saw the car crash",Barbara didn't saw the car crash,1
William created an eager and stocky work of art, William didn't create an eager work of art,1
Sonia and Allan have visited Turda,Ryan didn't visit Turda,0
"Ernest, who is a pilot, saw the new Marvel movie from the Russo Brothers","Ernest, who is a cop, didn't saw the new Marvel movie from the Russo Brothers",0
Arnold is tender and Mae is poor, Mae is not poor,1
Gladys created an unkempt and muscular work of art, Gladys didn't create an unkempt work of art,1
Neil told me everything and dug a hole,Danielle didn't dig a hole,0
Brian is better and Clinton is unimportant, Clinton is not unimportant,1
Jeanette is brave and Victoria is easy, Jeanette is not easy,0
Terry created a quaint and obnoxious work of art, Travis didn't create an obnoxious work of art,0
Micheal is alive and Isaac is odd, Isaac is not odd,1
Janet and Norman have visited Lugoj,Norman didn't visit Lugoj,1
Lillie left me and hit her,Rodney didn't leave me,0
"Morris, who is a musician, bought the new Tesla Roadster",Morris isn't a musician,1
Sandra saw a girl running from a red bus with a new engine,Sandra didn't saw a girl running from a special recently built bus,0
Karl said funny things and hid behind a bush,Naomi didn't say funny things,0
Rosie created an agreeable and beautiful work of art, Rosie didn't create an agreeable work of art,1
Luis came at night and read the news,Luis didn't catch a black fish,0
Virginia created a powerful and drab work of art, Sarah didn't create a drab work of art,0
Virgil created an ugly and inexpensive work of art, Nellie didn't create an ugly work of art,0
Freddie and Mary have traveled to Slobozia,Mary didn't travel to Slobozia,0
Nelson and Debra have traveled to Vaslui,Nelson didn't travel to Vaslui,0
"Elizabeth, who is a flight attendant, bought the new Tesla Roadster",Elizabeth isn't a flight attendant,1
"Kent, who is a builder, bought the new Marvel movie from the Russo Brothers",Kent isn't a builder,1
James hung up on Mark and flew to Deva,Bobbie didn't hang up on Mark,0
"Cathy, who is a receptionist, saw the city mayor",Cathy isn't a receptionist,1
Miguel is delightful and Angela is proud, Carole is not shy,0
Jon is lively and Christy is silly, Carmen is not dead,0
Rhonda dug a hole in the garden and ran into Brandi,Rhonda didn't bet on the wining horse,0
Franklin is gentle and Lawrence is agreeable, Thelma is poor,0
Lula has visited Reghin and Vaslui,Lula didn't visit Reghin,1
Cecilia is lively and Monica is important, Cecilia is not important,0
Brian is polite and Daisy is powerful, Daisy is not polite,0
Isaac went to Reghin and Timisoara,Isaac didn't go to Lugoj,0
Amy went to Javier's house and beat her,Amy didn't beat her,1
Floyd went to Turda and threw everything out the window,Floyd didn't take a summer job,0
"Linda, who is a carpenter, saw a strange add",Linda didn't saw a strange add,1
Teresa created a zealous and happy work of art, Teresa didn't create a zealous work of art,1
"Salvador, who is a chef, saw the new Marvel movie from the Russo Brothers","Salvador, who is a lawyer, didn't saw the new Marvel movie from the Russo Brothers",0
Judy dug a hole in the garden and bet on the gray car,Judy didn't dig a hole in the garden,1
Jessie created an attractive and fierce work of art, Jessie didn't create an attractive work of art,1
Linda created a bewildered and black work of art, Linda didn't create a bewildered work of art,1
Lisa is lively and Edward is polite, Catherine is better,0
Clifton created a shapely and wrong work of art, Allen didn't create a wrong work of art,0
Pauline is victorious and Edgar is nice, Clyde is not hallowed,0
Lance spent all my money and hit a tree,Veronica didn't spend all my money,0
Doris took office and gave Lois a mango car,Doris didn't take office,1
Matthew and Ellen have visited Arad,Matthew didn't visit Arad,1
Rosa went to Dej and Arad,Rosa didn't go to Dej,1
Rosemary understood what I said and drank an orange juice,Rosemary didn't understand what I said,1
"Tyler, who is a painter, saw a strange add","Tyler, who is a secretary, didn't saw a strange add",0
Keith is kind and Maxine is delightful, Keith is not kind,1
Melissa saw a boy running from a black car,Melissa didn't saw a boy running,1
Ben is easy and Wanda is tender, Wanda is not tender,1
Ricky is polite and Madeline is calm, Jeffery is uninterested,0
Darryl created a wrong and nice work of art, Donna didn't create a nice work of art,0
Sarah left me waiting and understood what Ted comment about Reghin,Sarah didn't leave me waiting,1
"Ada, who is a cleaner, visit Beth",Ada isn't a cleaner,1
Jean created a purple and gentle work of art, Leon didn't create a gentle work of art,0
Angie is faithful and Maurice is mealy, Maurice is not faithful,0
Tracey has visited Oradea and Slatina,Tracey didn't visit Reghin,0
"Barbara, who is a photographer, saw the new Marvel movie from the Russo Brothers",Barbara isn't a photographer,1
Salvador is brave and Nelson is silly, Salvador is not brave,1
Jim and Yvonne went to Deva,Yvonne didn't go to Turda,0
Danny created a gray and helpful work of art, Anthony didn't create a gray work of art,0
Lee created a clean and ambitious work of art, Lee didn't create a clean work of art,1
Ricky created a witty and flabby work of art, Ricky didn't create a witty work of art,1
Sidney created a delightful and gentle work of art, Erika didn't create a delightful work of art,0
"Olivia, who is a hairdresser, saw the city mayor","Olivia, Marvin's mother, didn't saw the city mayor",0
Darren bought a salmon car and laid his hands on her,Darren didn't lay his hands on her,1
Carolyn created a witty and angry work of art, Harold didn't create an angry work of art,0
Jenny is faithful and Jane is victorious, Jenny is not faithful,1
