sentence1,sentence2,label
Sidney is uninterested and Gordon is dead, Gordon is not dead,1
Enrique grew up in jail and won the soccer match,Jose didn't win the soccer match,0
Hugh created an embarrassed and repulsive work of art, Megan didn't create a repulsive work of art,0
Angela created a silly and attractive work of art, Jaime didn't create an attractive work of art,0
Stacey and Jack went to Bucharest,Gladys didn't go to Bucharest,0
Alicia saw a girl running from a yellow car,Alicia didn't saw a girl running,1
Leon has visited Dej and Turda,Leon didn't visit Dej,1
"Minnie, who is a butcher, visit Mildred","Minnie, Ruby's mother, didn't visit Mildred",0
Gregory has traveled to Dej and Deva,Travis didn't travel to Dej,0
Grace has visited Timisoara and Bucharest,Grace didn't visit Timisoara,1
Amelia is thankful and Beatrice is polite, Tammy is dead,0
Norma and Douglas have visited Deva,Norma didn't visit Deva,1
Clifton created a calm and important work of art, Clifton didn't create a calm work of art,1
Esther has traveled to Hunedoara and Turda,Sarah didn't travel to Hunedoara,0
Shelley and Alfred have traveled to Reghin,Alfred didn't travel to Reghin,1
Marie is gentle and Tanya is brave, Edwin is not alive,0
Stacy created a helpful and famous work of art, Stacy didn't create a helpful work of art,1
Heather has visited Slatina and Hunedoara,Heather didn't visit Slatina,1
"Karl, who is a carpenter, visit Joan",Karl didn't visit Joan,1
Hattie created an elegant and poor work of art, Hattie didn't create an unimportant work of art,0
Alfred saw Kathleen driving Earl's car,Alfred didn't saw Kathleen driving in Deva,0
Danielle saw a girl driving Andrea's new Tesla Roadster,Danielle didn't saw a girl driving a mango car,0
Shelly wore a gray jacket and laid down,Shelly didn't lay down,1
Karl is thankful and Crystal is eager, Grace is clever,0
Duane created an ashy and muscular work of art, Duane didn't create an ashy work of art,1
Stephanie thought I was living in Reghin and spoke to her about Philip,Stephanie didn't think I was living in Reghin,1
Ethel created a clever and mealy work of art, Ethel didn't create a clever work of art,1
Dorothy went to Cluj-Napoca and Mangalia,Dorothy didn't go to Mangalia,1
Chad is zealous and Barbara is lively, Javier is rich,0
Philip and Aaron went to Giurgiu,Aaron didn't go to Giurgiu,1
Kay is helpful and Diana is uninterested, Diana is not uninterested,1
Marilyn wrote me a letter and held him close,Marilyn didn't pay her,0
Valerie created an itchy and fancy work of art, Tanya didn't create a fancy work of art,0
Melody is eager and Stephen is nice, Melody is not eager,1
Dianne chose this soccer team and met Frank,Gabriel didn't meet Frank,0
"Ross, who is a accountant, bought a japanese novel","Ross, Ana's father, didn't buy a japanese novel",0
Jaime is aggressive and Norma is wrong, Jaime is not wrong,0
Heather has visited Oradea and Hunedoara,Heather didn't visit Oradea,1
Amy is rich and Leslie is wrong, Leslie is not wrong,1
Armando saw her and got me lying,Armando didn't see her,1
Lois sold Wallace's house and swam out toward the mango boat,Lois didn't sell Wallace's house,1
Ronald and Bradley have traveled to Blaj,Bradley didn't travel to Blaj,0
Anthony and Lula went to Vaslui,Edna didn't go to Vaslui,0
Sidney created a dead and obnoxious work of art, Sidney didn't create a dead work of art,1
Hugh went away and drank a bottle of water,Hugh didn't go away,1
Edgar created a glamorous and famous work of art, Edgar didn't create a glamorous work of art,1
Felix created a wrong and stocky work of art, Darrell didn't create a stocky work of art,0
"Verna, who is a pilot, visit Jessie",Verna didn't visit Jessie,1
Kristin created a purple and silly work of art, Kristin didn't create a purple work of art,1
Lydia built Olivia's house and said funny things,Brent didn't say funny things,0
Penny saw a girl running from a black bus with a new engine,Penny didn't saw a girl running from a salmon bus,0
Charlene is kind and Stanley is polite, Charlene is not kind,1
Blanche created a white and brave work of art, Blanche didn't create a white work of art,1
Cody is proud and Jacqueline is calm, Terri is not famous,0
Dorothy saw a girl running from a white bus,Dorothy didn't saw a girl running,1
Cynthia created a clever and wrong work of art, Marjorie didn't create a clever work of art,0
"Jonathan, who is a flight attendant, visit Molly","Jonathan, who is a butcher, didn't visit Molly",0
Sylvia was a calm person and understood what I said,Maggie wasn't a calm person,0
Norma is nice and Willie is important, Willie is not nice,0
Jack is witty and Georgia is zealous, Erin is easy,0
Billy has visited Turda and Craiova,Billy didn't visit Reghin,0
"Kayla, who is a musician, visit Philip",Kayla didn't visit Philip,1
Ramona is witty and Dwayne is easy, Ramona is not easy,0
"Jeremy, who is a accountant, saw a girl running","Jeremy, who is a butcher, didn't saw a girl running",0
Rhonda has traveled to Craiova and Tulcea,Rhonda didn't travel to Slobozia,0
Rosie is alive and Lillie is unimportant, Lillie is not unimportant,1
Natasha is nice and Rita is gentle, Natasha is not nice,1
Edward understood what Deborah comment about Tulcea and bet on the game,Edward didn't bet on the game,1
Kim went to Baia Mare and Hunedoara,Kim didn't go to Slatina,0
Courtney is wonderful and Kevin is better, Kevin is not wonderful,0
Victoria created a happy and long work of art, Victoria didn't create a happy work of art,1
"Caroline, who is a accountant, bought a pizza",Caroline didn't buy a pizza,1
Zachary has traveled to Slatina and Giurgiu,Zachary didn't travel to Hunedoara,0
Brett went to Turda and Mangalia,Brett didn't go to Mangalia,1
Beth is powerful and Bernice is famous, Bernice is not famous,1
Donald is victorious and Lee is proud, Dwight is not helpful,0
Louis created a victorious and helpful work of art, Louis didn't create a repulsive work of art,0
Nancy created a polite and grumpy work of art, Nancy didn't create a polite work of art,1
Reginald saw a girl running from a white bus with a new engine,Reginald didn't saw a girl running from a special recently built bus,0
Bonnie created a mushy and magnificent work of art, Bonnie didn't create a mushy work of art,1
"Andrew, who is a flight attendant, visit James","Andrew, who is a doctor, didn't visit James",0
Alfred created a dazzling and rich work of art, Alfred didn't create a dazzling work of art,1
Lloyd has traveled to Lugoj and Bucharest,Lloyd didn't travel to Mangalia,0
Peggy is aggressive and Adam is brave, Jose is not shy,0
Alvin created a scruffy and mysterious work of art, Alvin didn't create a scruffy work of art,1
Alex is dead and Ella is powerful, Ella is not powerful,1
Eva saw a girl driving Bertha's new Tesla Roadster,Eva didn't saw a girl driving,1
Tonya and Kurt have visited Baia Mare,Tonya didn't visit Baia Mare,1
Christopher and Luis have traveled to Vaslui,Luis didn't travel to Hunedoara,0
Francisco is agreeable and Peter is proud, Francisco is not agreeable,1
"Harvey, who is a accountant, visit Tonya","Harvey, who is a plumber, didn't visit Tonya",0
"Cindy, who is a cleaner, saw the car crash",Cindy didn't saw the car crash,1
Sheila saw Kathy running from a bus going to Bucharest,Sheila didn't saw Kathy running,1
Leon created an easy and scary work of art, Leon didn't create an easy work of art,1
Darrell has visited Cluj-Napoca and Slatina,Darrell didn't visit Dej,0
"Timothy, who is a musician, bought the new Marvel movie from the Russo Brothers",Timothy didn't buy the new Marvel movie from the Russo Brothers,1
"Lindsay, who is a judge, bought the new Marvel movie from the Russo Brothers","Lindsay, Kathy's mother, didn't buy the new Marvel movie from the Russo Brothers",0
Christy and Derek have visited Mangalia,Christy didn't visit Mangalia,1
Kristy and Javier have traveled to Timisoara,Javier didn't travel to Cluj-Napoca,0
Rick has visited Deva and Reghin,Gene didn't visit Deva,0
Rick and Paula have visited Timisoara,Paula didn't visit Cluj-Napoca,0
Craig created an inexpensive and easy work of art, Craig didn't create an inexpensive work of art,1
Jane is thankful and Bernice is helpful, Bernice is not thankful,0
Steve created a hallowed and skinny work of art, Steve didn't create a hallowed work of art,1
Nelson is agreeable and Nathan is nice, Angie is tender,0
Julie went to Cluj-Napoca and Mangalia,Julie didn't go to Timisoara,0
Belinda is zealous and Daniel is happy, Cody is not poor,0
Bessie created a green and rich work of art, Erin didn't create a rich work of art,0
Alvin created an unsightly and embarrassed work of art, Anita didn't create an unsightly work of art,0
"Robert, who is a musician, visit Isabel",Robert isn't a musician,1
Marion and Phyllis have traveled to Baia Mare,Phyllis didn't travel to Baia Mare,1
Craig created a careful and black work of art, Craig didn't create a careful work of art,1
Lori is victorious and Sheila is polite, Lori is not victorious,1
Megan is famous and Harry is mealy, Harry is not mealy,1
Kristin is brave and Faye is silly, Willard is not better,0
Shelly beat us a lot and held him close,Kristine didn't beat us a lot,0
"Vivian, who is a scientist, visit Elsie",Vivian isn't a scientist,1
Ted has visited Arad and Timisoara,Ted didn't visit Arad,1
Yvonne is silly and Jason is wonderful, Dennis is not poor,0
Micheal is ambitious and Mitchell is mealy, Micheal is not mealy,0
Sally has visited Oradea and Timisoara,Sally didn't visit Giurgiu,0
Jimmie created a handsome and plain work of art, Jimmie didn't create a mushy work of art,0
"Lillian, who is a tailor, bought a Chilean wine",Lillian isn't a tailor,1
Juan created a shapely and magnificent work of art, Juan didn't create a shapely work of art,1
"Rebecca, who is a baker, bought a pizza",Rebecca isn't a baker,1
Carole has visited Arad and Timisoara,Carole didn't visit Vaslui,0
"Wendy, who is a baker, bought a cup of coffee",Wendy didn't buy a cup of coffee,1
Monique created an alive and gray work of art, Monique didn't create a black work of art,0
Josephine created an ugly and important work of art, Josephine didn't create an ugly work of art,1
Kelly created an orange and clever work of art, Kelly didn't create an orange work of art,1
Victoria created a dazzling and gentle work of art, Marlene didn't create a dazzling work of art,0
Jose created a blue and ugly work of art, Jose didn't create a blue work of art,1
"Ramon, who is a painter, bought a Macbook",Ramon isn't a painter,1
Louise is delightful and Raul is victorious, Geraldine is mushy,0
Alfredo created a pitiful and grumpy work of art, Alfredo didn't create a pitiful work of art,1
Gabriel created a jealous and wrong work of art, Gabriel didn't create a jealous work of art,1
Craig went to Bucharest and Oradea,Craig didn't go to Oradea,1
Tommy has traveled to Timisoara and Cluj-Napoca,Tommy didn't travel to Timisoara,1
Calvin is vast and Nicholas is poor, Nicholas is not poor,1
Irma saw a boy driving Julie's bicycle,Irma didn't saw a boy driving a gray bicycle,0
Minnie is ambitious and Ashley is delightful, Harold is inexpensive,0
"Fannie, who is a hairdresser, visit Melody","Fannie, who is a technician, didn't visit Melody",0
Ella and Dana have visited Dej,Anna didn't visit Dej,0
Anita rode the horse and hung up on me,Clinton didn't hang up on me,0
Pauline flew to Blaj and went to Lindsay's house,Pauline didn't fly to Blaj,1
"Charlotte, who is a receptionist, visit Amy","Charlotte, Brent's mother, didn't visit Amy",0
Sheila is wrong and Anne is unimportant, Anne is not unimportant,1
Molly is alive and Todd is hallowed, Todd is not hallowed,1
Rhonda and Luz have traveled to Vaslui,Mamie didn't travel to Vaslui,0
"Perry, who is a tailor, visit Marsha",Perry didn't visit Marsha,1
Vanessa went to Oradea and Dej,Vicki didn't go to Oradea,0
Carolyn drank a beer and made coffee,Carolyn didn't build a computer,0
Duane read the news and sang a nice song,Duane didn't sing a nice song,1
Ivan went to Bucharest and Oradea,Alexander didn't go to Bucharest,0
Pauline took the ashy shirt out of the washer and bought a red car,Pauline didn't buy a red car,1
Sean is thankful and Elaine is jolly, Michelle is not powerful,0
Mitchell is calm and Marlene is clever, Marlene is not calm,0
Shannon saw Stephen running from a orange bus with a new engine,Shannon didn't saw Stephen running from Jared's car,0
Cathy is brave and Ross is easy, Ross is not brave,0
Roger saw a boy driving Elmer's car,Roger didn't saw a boy driving a icy bicycle,0
Kelly and Nathaniel went to Timisoara,Nathaniel didn't go to Timisoara,1
Gwendolyn created an alive and polite work of art, Gwendolyn didn't create an obedient work of art,0
Ted is nice and Maryann is careful, Ted is not careful,0
Lorraine was the first in line and swam out toward the green boat,Lorraine didn't swim out toward the green boat,1
Kelly is silly and Andrea is helpful, Kelly is not helpful,0
Phyllis lost my computer and spent all my money,Phyllis didn't know about us,0
Clinton put the phone down and forgave me,Clinton didn't forgive me,1
Janet is clever and Yolanda is wrong, Yolanda is not wrong,1
Nelson has visited Giurgiu and Tulcea,Walter didn't visit Tulcea,0
Dale is alive and Jeffrey is inexpensive, Jeffrey is not inexpensive,1
Roger met him and understood what Isaac comment about Craiova,Maryann didn't understand what Isaac comment about Craiova,0
Nathan is brave and Billie is delightful, Nathan is not brave,1
Sylvia saw a boy driving Genevieve's car,Sylvia didn't saw a boy driving,1
Joshua drove the truck to Joseph's house and sat on the floor,Joshua didn't sit on the floor,1
Dwight was a lively person and wore a gray hat,Dwight didn't wear a gray hat,1
Eileen saw a girl driving in Craiova,Eileen didn't saw a girl driving,1
Tim created an attractive and gifted work of art, Tim didn't create an attractive work of art,1
Frederick and Sam have visited Giurgiu,Gordon didn't visit Giurgiu,0
Rafael did some good work and shut the door down,Rafael didn't shut the door down,1
Grace created a faithful and beautiful work of art, Ivan didn't create a faithful work of art,0
Glen is gentle and George is calm, Georgia is famous,0
Terri got the money and cut himself,Cecilia didn't cut himself,0
"Melanie, who is a journalist, visit Hilda",Melanie didn't visit Hilda,1
Genevieve understood what Franklin comment about Turda and grew up in jail,Darren didn't understand what Franklin comment about Turda,0
Belinda is obedient and Maryann is jolly, Hilda is not mushy,0
Alberta created a gray and witty work of art, Alberta didn't create a gray work of art,1
"Leah, who is a photographer, saw the new Marvel movie from the Russo Brothers","Leah, who is a nurse, didn't saw the new Marvel movie from the Russo Brothers",0
Daryl and Tamara went to Bucharest,Daryl didn't go to Reghin,0
Becky is nice and Katherine is jolly, Terrance is powerful,0
Martha went to Turda and Hunedoara,Sylvia didn't go to Hunedoara,0
Carla drew ahead of the other runners and heard Casey,Carla didn't forget about Jaime's hobby,0
Cody created a kind and unimportant work of art, Jeffrey didn't create an unimportant work of art,0
"Tommy, who is a bartender, bought the new Marvel movie from the Russo Brothers","Tommy, who is a technician, didn't buy the new Marvel movie from the Russo Brothers",0
Karen and Samantha went to Blaj,Samantha didn't go to Blaj,1
Duane and Lawrence have traveled to Hunedoara,Lawrence didn't travel to Hunedoara,1
Rita and Jon went to Reghin,Rita didn't go to Reghin,1
Edna went to Bucharest and Tulcea,Edna didn't go to Bucharest,1
"Dana, who is a receptionist, visit Floyd",Dana isn't a receptionist,1
Becky saw Ralph running from Audrey's car,Becky didn't saw Ralph running,1
Dave hung up on Marcus and wore a mango hat,Dave wasn't a nice person,0
Stacey has traveled to Bucharest and Turda,Stacey didn't travel to Baia Mare,0
"Phillip, who is a tailor, visit Victor",Phillip didn't visit Victor,1
Molly and Natalie went to Hunedoara,Natalie didn't go to Giurgiu,0
Clayton and Tonya have visited Dej,Clayton didn't visit Dej,1
Terrence created a zealous and helpless work of art, Terrence didn't create a zealous work of art,1
"Kirk, who is a photographer, visit Catherine",Kirk didn't visit Catherine,1
Hattie and Timothy have visited Baia Mare,David didn't visit Baia Mare,0
Randy created an odd and shapely work of art, Randy didn't create an odd work of art,1
Delores and Beulah have traveled to Vaslui,Beulah didn't travel to Cluj-Napoca,0
Leo drew ahead of the other runners and bought a orange car,Tara didn't draw ahead of the other runners,0
Audrey wrote me an email and drank a bottle of wine,Audrey didn't write me an email,1
"Sandy, who is a journalist, visit Lawrence","Sandy, who is a scientist, didn't visit Lawrence",0
Jeanne created a witty and faithful work of art, Felicia didn't create a witty work of art,0
Patrick is dead and Theresa is vast, Theresa is not vast,1
Olivia has visited Bucharest and Hunedoara,Olivia didn't visit Timisoara,0
Leonard forgave Dwayne and burned Michael's house,Leonard didn't burn Michael's house,1
Kenneth and Carol have visited Dej,Maxine didn't visit Dej,0
Mathew and Don have traveled to Giurgiu,Mathew didn't travel to Giurgiu,1
Regina created a grumpy and witty work of art, Clayton didn't create a grumpy work of art,0
Alberta is thankful and Pamela is zealous, Alberta is not thankful,1
Mathew is eager and Deanna is happy, Tyler is shy,0
Ian has traveled to Giurgiu and Oradea,Ian didn't travel to Craiova,0
Melissa created an agreeable and bald work of art, Melissa didn't create an agreeable work of art,1
Aaron is faithful and Ben is witty, Irene is clever,0
"Chad, who is a painter, saw the city mayor","Chad, Jackie's father, didn't saw the city mayor",0
Bobbie created a silly and thoughtless work of art, Bobbie didn't create a silly work of art,1
Harry has traveled to Giurgiu and Slobozia,Harry didn't travel to Slobozia,1
"Kirk, who is a secretary, bought a Chilean wine",Kirk isn't a secretary,1
Tiffany is poor and Helen is mealy, Helen is not mealy,1
Monica slept for one day and began screaming,Monica didn't teach middle school science,0
Judy has traveled to Mangalia and Slobozia,Judy didn't travel to Mangalia,1
Lucy is ambitious and Kevin is gifted, Kevin is not ambitious,0
Jeff is eager and Lillie is vast, Lillie is not eager,0
Barry went to Bucharest and Slatina,Barry didn't go to Bucharest,1
Roberto went to Dej and Slobozia,Constance didn't go to Dej,0
Elsie created a jealous and ashy work of art, Sheryl didn't create a jealous work of art,0
Susan has traveled to Cluj-Napoca and Baia Mare,Susan didn't travel to Baia Mare,1
"Esther, who is a flight attendant, saw the new Marvel movie from the Russo Brothers","Esther, who is a technician, didn't saw the new Marvel movie from the Russo Brothers",0
"Vernon, who is a electrician, bought a japanese novel",Vernon didn't buy a japanese novel,1
Dana is gentle and Carrie is lively, Dana is not gentle,1
"Clarence, who is a baker, saw a strange add","Clarence, who is a cashier, didn't saw a strange add",0
Nathaniel heard Leon and wore a ashy jacket,Louis didn't wear a ashy jacket,0
Anita created a delightful and angry work of art, Anita didn't create a delightful work of art,1
"Lydia, who is a accountant, visit Melvin","Lydia, Miguel's mother, didn't visit Melvin",0
Howard created a tender and black work of art, Howard didn't create a brave work of art,0
Billie showed my new photos and went to Willie's house,Billie didn't teach math,0
Cheryl created a lazy and victorious work of art, Cheryl didn't create a lazy work of art,1
Wesley is shy and Heidi is uninterested, Heidi is not uninterested,1
Tyler created a bald and brave work of art, Tyler didn't create a bald work of art,1
Richard saw Lucille driving in Arad,Richard didn't saw Lucille driving,1
Amanda has traveled to Bucharest and Turda,Salvador didn't travel to Bucharest,0
Ray is silly and Henry is obedient, Maggie is clever,0
Kathryn and Dave have visited Reghin,Christopher didn't visit Reghin,0
Rodney is kind and Timothy is rich, Timothy is not kind,0
Jeffery is brave and Gilbert is jolly, Jeffery is not brave,1
Ramon and Alfredo have visited Turda,Alfredo didn't visit Deva,0
Gertrude created a dead and happy work of art, Gertrude didn't create a dead work of art,1
Virgil created an alive and hallowed work of art, Virgil didn't create an alive work of art,1
Ronnie is wonderful and Antoinette is jolly, Ronnie is not wonderful,1
Eva created a happy and helpful work of art, Eva didn't create a happy work of art,1
Rose has traveled to Bucharest and Craiova,Sally didn't travel to Bucharest,0
Louise went to Lugoj and Reghin,Louise didn't go to Lugoj,1
Helen created a happy and fancy work of art, Andy didn't create a happy work of art,0
Gladys has visited Arad and Lugoj,Gladys didn't visit Lugoj,1
Jessie is easy and Sergio is helpful, Sergio is not helpful,1
"Jessie, who is a lawyer, visit Jesse",Jessie didn't visit Jesse,1
Candace created a proud and muscular work of art, Steven didn't create a muscular work of art,0
Sean and Lori have traveled to Tulcea,Lori didn't travel to Tulcea,1
Nelson showed Misty's old photos and hurt him,Ben didn't hurt him,0
Angie burned some calories and found him,Angie didn't find him,1
Antoinette is wrong and Stephanie is gifted, Stephanie is not gifted,1
Leah has visited Oradea and Reghin,Leah didn't visit Timisoara,0
Bernice is victorious and Annette is kind, Sandra is shy,0
Connie became the most important engineer in this town and dreamed of the being a lawyer,Connie didn't dream of the being a lawyer,1
Warren stood up to Douglas and hid a smile,Warren didn't stand up to Douglas,1
Willard saw a girl running from a green car,Willard didn't saw a girl running,1
Tonya knew Joyce's secret and bent the rules of the card game,Tonya didn't know Joyce's secret,1
Clarence created a proud and lively work of art, Clarence didn't create a wrong work of art,0
Jane saw Leo running from a parade car,Jane didn't saw Leo running from a mango bus with a new engine,0
Karen went to Slobozia and Timisoara,Kirk didn't go to Timisoara,0
Deanna saw Patrick running from a blue bus with a new engine,Deanna didn't saw Patrick running,1
"Christian, who is a plumber, visit Beverly","Christian, Derrick's father, didn't visit Beverly",0
Steve hid a smile and drank an orange juice,Vickie didn't drink an orange juice,0
Belinda and Eduardo have visited Giurgiu,Eduardo didn't visit Giurgiu,1
Edith created a lively and scruffy work of art, Jaime didn't create a lively work of art,0
Joan is jolly and Erik is uninterested, Joan is not uninterested,0
Angela has traveled to Craiova and Turda,Angela didn't travel to Craiova,1
Donald has visited Slatina and Mangalia,Donald didn't visit Mangalia,1
Belinda and Clifford have visited Turda,Belinda didn't visit Lugoj,0
Kirk woke up and went away,Kirk didn't shut the door down,0
"Bessie, who is a butcher, bought a Macbook",Bessie didn't buy a Macbook,1
Kelly bet on the mango car and put the phone down,Kelly didn't put the phone down,1
Roy and Cassandra went to Tulcea,Roy didn't go to Timisoara,0
Craig gave Colleen a purple shirt and beat Eugene out of 20 dollars,Craig didn't know Cory's secret,0
Roland and Stacy have traveled to Timisoara,Roland didn't travel to Timisoara,1
Linda and Charlie have visited Deva,Willie didn't visit Deva,0
Tamara and Denise have visited Deva,Denise didn't visit Mangalia,0
Adam went to Dej and Bucharest,Adam didn't go to Bucharest,1
Joe and Kay have traveled to Oradea,Joe didn't travel to Oradea,1
Jean created a proud and alive work of art, Jean didn't create a proud work of art,1
Louise has traveled to Tulcea and Reghin,Louise didn't travel to Giurgiu,0
Wesley saw Gladys running from a special recently built bus,Wesley didn't saw Gladys running from a parade car,0
Sarah saw Bryan driving in Cluj-Napoca,Sarah didn't saw Bryan driving,1
Lucille and Russell have visited Hunedoara,Russell didn't visit Hunedoara,1
Kathryn heard Alfred and saw Jesus,Katrina didn't see Jesus,0
Tonya is faithful and Shane is ambitious, Andrea is not hallowed,0
"Mildred, who is a receptionist, saw a strange add",Mildred didn't saw a strange add,1
Elmer saw a boy driving a purple car,Elmer didn't saw a boy driving,1
Ricky and Billie have visited Arad,Janie didn't visit Arad,0
Vincent saw a girl running from a yellow bus,Vincent didn't saw a girl running from a parade car,0
"Diana, who is a carpenter, bought a cup of coffee",Diana didn't buy a cup of coffee,1
Stanley and Floyd have traveled to Reghin,Floyd didn't travel to Reghin,1
Carolyn created a clumsy and mealy work of art, Carolyn didn't create a famous work of art,0
Clifford blew it when he didn't invest in Amazon and shut the door down,Clifford didn't shut the door down,1
Kurt got me lying and did it again,Kurt didn't get me lying,1
"Leon, who is a technician, visit Catherine",Leon didn't visit Catherine,1
Harry is poor and Jo is helpful, Jo is not helpful,1
Vanessa is wonderful and Ella is inexpensive, Vanessa is not inexpensive,0
Joann created a proud and inexpensive work of art, Joann didn't create an uptight work of art,0
Rachel created a clean and dead work of art, Rachel didn't create a clean work of art,1
"Jerry, who is a musician, bought a Chilean wine",Jerry isn't a musician,1
"Douglas, who is a pilot, saw the car crash","Douglas, who is a flight attendant, didn't saw the car crash",0
Carla and Phyllis went to Tulcea,Gertrude didn't go to Tulcea,0
Valerie and Patrick have traveled to Vaslui,Patrick didn't travel to Vaslui,1
Charles began laughing and hit me,Charles didn't hit me,1
"Erika, who is a pilot, visit Duane",Erika didn't visit Duane,1
Angie put the phone down and threw everything out the window,Christopher didn't put the phone down,0
Ralph and Amy have traveled to Mangalia,Darrell didn't travel to Mangalia,0
