sentence1,sentence2,label
Lucille is happy and Crystal is lively, Jeffery is not rich,0
Juanita has visited Vaslui and Deva,Juanita didn't visit Deva,1
Maxine has visited Bucharest and Giurgiu,Cecilia didn't visit Bucharest,0
Brenda slept the night and paid him,Stephen didn't sleep the night,0
Olivia saw a girl running from a special recently built bus,Olivia didn't saw a girl running,1
"Angela, who is a tailor, saw the city mayor","Angela, who is a scientist, didn't saw the city mayor",0
Lula has traveled to Hunedoara and Craiova,Lula didn't travel to Craiova,1
Rodney is agreeable and Timothy is zealous, Herbert is dead,0
Eileen is zealous and Carrie is gentle, Wanda is poor,0
Todd dreamed of the playing with Sonya and ran into Glenn,Todd didn't ring into Glenn,1
Rosa created a witty and zealous work of art, Yolanda didn't create a zealous work of art,0
"Ellen, who is a secretary, visit Sheila",Ellen didn't visit Sheila,1
Bonnie created a mysterious and helpful work of art, Bonnie didn't create a mysterious work of art,1
"Marie, who is a accountant, bought a japanese novel","Marie, who is a doctor, didn't buy a japanese novel",0
Verna is eager and Stella is aggressive, Adrian is not clever,0
Jeffrey created a jolly and green work of art, Randy didn't create a jolly work of art,0
"Marsha, who is a pilot, saw the car crash",Marsha isn't a pilot,1
Alfredo created a kind and purple work of art, Alfredo didn't create a kind work of art,1
Alberto is vast and Sergio is important, Sergio is not important,1
Mathew and Jessie have traveled to Oradea,Floyd didn't travel to Oradea,0
Loretta is wrong and Amelia is alive, Amelia is not alive,1
Joanne and Cecil went to Lugoj,Ana didn't go to Lugoj,0
Alexander created a helpful and clean work of art, Alexander didn't create a helpful work of art,1
Ricardo and Jesus have visited Deva,Ricardo didn't visit Oradea,0
Jo created an ashy and glamorous work of art, Jo didn't create a victorious work of art,0
Jamie hung up on me and woke up,Jamie didn't bet on the game,0
Carrie went to Giurgiu and Arad,Carrie didn't go to Lugoj,0
Kim saw a girl running from a ashy car,Kim didn't saw a girl running from Irma's car,0
"Neil, who is a chef, bought a pizza","Neil, Charlotte's father, didn't buy a pizza",0
"April, who is a electrician, visit Colleen",April didn't visit Colleen,1
Luis and Edwin have visited Arad,Luis didn't visit Blaj,0
Martha and James went to Deva,Martha didn't go to Deva,1
Patrick and Steven went to Bucharest,Patrick didn't go to Bucharest,1
Diana is kind and Doris is brave, Margie is clever,0
Louis has traveled to Deva and Baia Mare,Louis didn't travel to Baia Mare,1
Claire got the money and gave Madeline a yellow shirt,Claire didn't get the money,1
Marguerite created a hallowed and defeated work of art, Marguerite didn't create a hallowed work of art,1
"Seth, who is a fireman, saw the car crash",Seth isn't a fireman,1
Kristen is calm and Mary is clever, Mary is not calm,0
Christy created a tender and grumpy work of art, Marlene didn't create a tender work of art,0
Olivia got me lying and came at noon,Olivia didn't come at noon,1
Adam has traveled to Deva and Turda,Adam didn't travel to Turda,1
"Peggy, who is a cashier, visit Geneva","Peggy, Mabel's mother, didn't visit Geneva",0
Dave created a worried and glamorous work of art, Ted didn't create a glamorous work of art,0
Rosie created an unkempt and orange work of art, Rosie didn't create an unkempt work of art,1
Ian saw Marvin running from a white car,Ian didn't saw Marvin running,1
Gabriel told me everything and rode the buffalo,Gabriel didn't tell me everything,1
Carrie is eager and Carla is victorious, Carrie is not eager,1
"Douglas, who is a fireman, visit Bradley",Douglas isn't a fireman,1
Caroline created a poor and lemon work of art, Caroline didn't create a poor work of art,1
"Brittany, who is a dentist, visit Mike","Brittany, Hugh's mother, didn't visit Mike",0
Mattie saw a girl driving a green bicycle,Mattie didn't saw a girl driving a gray car,0
Dolores has visited Timisoara and Turda,Dolores didn't visit Timisoara,1
Eddie is kind and Ana is lively, Eddie is not kind,1
Peter and Penny went to Reghin,Penny didn't go to Reghin,1
Lucy created a fancy and silly work of art, Lucy didn't create a fancy work of art,1
Cody forgave me and held me back,Cody didn't hold me back,1
Virginia is jolly and Rosemary is dead, Rosemary is not jolly,0
Charles created an uptight and ugly work of art, Vernon didn't create an uptight work of art,0
Johnnie and Sara went to Dej,Johnnie didn't go to Dej,1
Gertrude drank a bottle of water and began laughing,Gertrude didn't begin laughing,1
Felix is important and Edward is important, Edward is not important,1
Iris and Raymond went to Cluj-Napoca,Iris didn't go to Cluj-Napoca,1
Kristy saw Gladys running from a parade car,Kristy didn't saw Gladys running from a bus going to Slatina,0
Arnold and Agnes went to Reghin,Agnes didn't go to Reghin,1
Emily created a jolly and skinny work of art, Kimberly didn't create a skinny work of art,0
Belinda created a white and handsome work of art, Belinda didn't create a white work of art,1
Florence kept the game alive and did everything,Lance didn't do everything,0
"George, who is a carpenter, visit Nelson","George, who is a cleaner, didn't visit Nelson",0
Roland created a careful and beautiful work of art, Janice didn't create a careful work of art,0
Chris created a vast and salmon work of art, Chris didn't create an uninterested work of art,0
"Carol, who is a cleaner, visit Courtney",Carol isn't a cleaner,1
Kenneth spoke to her about Andy and thought Jan was going to die,Kenneth didn't speak to her about Andy,1
Christina and Hugh went to Oradea,Ana didn't go to Oradea,0
Lance and Lee have visited Arad,Myrtle didn't visit Arad,0
Andy created an ugly and plain work of art, Andy didn't create a scary work of art,0
Rafael is brave and Doris is jolly, Don is alive,0
Joanne is zealous and Derek is gentle, Geneva is not gifted,0
Marion is shy and Sandy is dead, Sandy is not dead,1
Jenny has traveled to Slobozia and Slobozia,Corey didn't travel to Slobozia,0
Darren has visited Lugoj and Tulcea,Darren didn't visit Tulcea,1
Hugh and Nicholas went to Craiova,Debbie didn't go to Craiova,0
Pauline created a green and unimportant work of art, David didn't create a green work of art,0
Beulah is dead and Phyllis is poor, Phyllis is not poor,1
Dianne has visited Tulcea and Bucharest,Dianne didn't visit Bucharest,1
Yolanda is brave and Tracy is shy, Tracy is not brave,0
Vincent grew up in jail and came at noon,Vincent didn't buy a watch,0
"Adrian, who is a cashier, bought the new Marvel movie from the Russo Brothers","Adrian, who is a receptionist, didn't buy the new Marvel movie from the Russo Brothers",0
Sidney wrote me about Rosemary and woke up,Sidney didn't write me about Rosemary,1
Leo has traveled to Tulcea and Timisoara,Leo didn't travel to Timisoara,1
"Glen, who is a engineer, bought a pizza",Glen isn't a engineer,1
Hector saw a boy running from a red bus with a new engine,Hector didn't saw a boy running,1
Miriam found what I was looking for and became the most important accountant in this town,Miriam didn't leave me,0
Rose is aggressive and Jack is lively, Rose is not aggressive,1
Katie is vast and Belinda is hallowed, Belinda is not hallowed,1
Cynthia is easy and Erin is inexpensive, Erin is not inexpensive,1
"Tiffany, who is a builder, bought a cup of coffee",Tiffany isn't a builder,1
Jordan created a fierce and elegant work of art, Jordan didn't create a nervous work of art,0
Heidi has visited Arad and Craiova,Pamela didn't visit Arad,0
Mario saw a girl running from a white school bus,Mario didn't saw a girl running,1
Loretta created a scruffy and alive work of art, Joan didn't create an alive work of art,0
Tamara has traveled to Craiova and Bucharest,Tamara didn't travel to Cluj-Napoca,0
Christy hid behind a bush and won the soccer match,Beulah didn't win the soccer match,0
Don went to Cluj-Napoca and Lugoj,Don didn't go to Cluj-Napoca,1
Phillip is proud and Tracy is obedient, Phillip is not proud,1
Natasha has traveled to Tulcea and Bucharest,Natasha didn't travel to Tulcea,1
Lucille is important and Loretta is clever, Loretta is not clever,1
Jill and Terry have visited Baia Mare,Jill didn't visit Baia Mare,1
Vickie created a polite and worried work of art, Vickie didn't create a polite work of art,1
Glen and Ronnie have traveled to Reghin,Glen didn't travel to Reghin,1
"Ruth, who is a chef, bought the new Marvel movie from the Russo Brothers","Ruth, Milton's mother, didn't buy the new Marvel movie from the Russo Brothers",0
Albert created an ambitious and mysterious work of art, Albert didn't create an ambitious work of art,1
Leslie created a panicky and mushy work of art, Stephanie didn't create a mushy work of art,0
Guy created a brave and odd work of art, Guy didn't create a brave work of art,1
Sonya created a gorgeous and zealous work of art, Yvette didn't create a gorgeous work of art,0
"Jessie, who is a flight attendant, visit Seth","Jessie, who is a pilot, didn't visit Seth",0
"Carmen, who is a receptionist, visit Christian",Carmen isn't a receptionist,1
Ian is witty and Terry is poor, Ian is not poor,0
"Nicholas, who is a vet, bought a japanese novel","Nicholas, Edith's father, didn't buy a japanese novel",0
Gordon won the soccer match and laid his hands on her,Gordon didn't lay his hands on her,1
Kelly left me and read the news,Kelly didn't leave me,1
Fannie saw a boy running from a parade car,Fannie didn't saw a boy running from a bus going to Timisoara,0
Melissa has traveled to Dej and Turda,Melissa didn't travel to Turda,1
Virgil let me drive Gertrude's green car and began screaming,Virgil didn't let me drive Gertrude's green car,1
"Jonathan, who is a nurse, visit Priscilla","Jonathan, Kurt's father, didn't visit Priscilla",0
"Dan, who is a secretary, visit Gladys","Dan, Dianne's father, didn't visit Gladys",0
Cheryl has traveled to Timisoara and Baia Mare,Cheryl didn't travel to Baia Mare,1
Gene found this green car and left Barcelona for Oradea,Gene didn't find this green car,1
Karl saw a boy running from a icy bus with a new engine,Karl didn't saw a boy running,1
"Florence, who is a technician, bought a Chilean wine",Florence isn't a technician,1
Maggie is brave and Naomi is wonderful, Maggie is not brave,1
Amber saw a boy driving in Giurgiu,Amber didn't saw a boy driving a gray car,0
Alfred and Ramona have visited Craiova,Alfred didn't visit Arad,0
Felix spent all my money and showed Inez's old photos,Felix didn't spend all my money,1
Joseph is ambitious and Sylvia is jolly, Joseph is not ambitious,1
Paul created an unsightly and salmon work of art, Paul didn't create an embarrassed work of art,0
Kurt created a short and orange work of art, Kurt didn't create a short work of art,1
Claudia is nice and Darren is zealous, Nellie is rich,0
Salvador is hallowed and Nellie is rich, Nellie is not rich,1
Judith saw a girl running from a yellow school bus,Judith didn't saw a girl running,1
Marjorie created a helpless and alive work of art, Marjorie didn't create a helpless work of art,1
Shane created a mealy and eager work of art, Shane didn't create a mealy work of art,1
Scott created a thankful and brave work of art, Scott didn't create a thankful work of art,1
"Raul, who is a scientist, bought a japanese novel","Raul, Heather's father, didn't buy a japanese novel",0
Lance rode the horse and had everything,Lance didn't ride the horse,1
Sue created a green and agreeable work of art, Sue didn't create a green work of art,1
"Sally, who is a builder, saw the car crash",Sally isn't a builder,1
Fannie and Jordan went to Turda,Jordan didn't go to Turda,1
Arthur is rich and Wayne is rich, Wayne is not rich,1
Carmen created a shy and salmon work of art, Ricky didn't create a salmon work of art,0
Blanche is faithful and Ella is wonderful, Joanne is helpful,0
Catherine forgot about Claude's past and brought me out of Tony's house,Catherine didn't teach middle school science,0
Gordon saw Ada driving a blue car,Gordon didn't saw Ada driving in Blaj,0
Chris created a thoughtless and powerful work of art, Chris didn't create a thoughtless work of art,1
"Jorge, who is a barber, saw a blue plane","Jorge, George's father, didn't saw a blue plane",0
Rhonda created an obnoxious and bald work of art, Rhonda didn't create an obnoxious work of art,1
Ana created an agreeable and fit work of art, Ana didn't create an agreeable work of art,1
Jamie is faithful and Julian is careful, Jamie is not careful,0
"Brittany, who is a journalist, bought a pizza","Brittany, Kay's mother, didn't buy a pizza",0
Teresa slept the night and let this happen,Teresa didn't let this happen,1
"Leah, who is a nurse, visit Fannie","Leah, who is a photographer, didn't visit Fannie",0
Carolyn brought me out of Linda's house and put the phone down,Carolyn didn't bring me out of Linda's house,1
"Marshall, who is a vet, saw a strange add","Marshall, Pearl's father, didn't saw a strange add",0
Curtis is lively and Kelly is witty, Megan is not tender,0
"Clara, who is a plumber, bought the new Marvel movie from the Russo Brothers",Clara isn't a plumber,1
Billie fell in love with Gregory and swam out toward the blue boat,Billie didn't swim out toward the blue boat,1
Tony created an elegant and powerful work of art, Cecilia didn't create a powerful work of art,0
Leroy created a brave and long work of art, Freddie didn't create a brave work of art,0
Naomi and Sharon have traveled to Mangalia,Mitchell didn't travel to Mangalia,0
Morris is odd and Dorothy is unimportant, Dorothy is not unimportant,1
Sue created a dead and ambitious work of art, Sue didn't create a dead work of art,1
Fred created a careful and obnoxious work of art, Fred didn't create a gentle work of art,0
Jeffrey showed Alan's old photos and wore a yellow hat,Clyde didn't wear a yellow hat,0
Lydia saw a girl running from a green bus with a new engine,Lydia didn't saw a girl running,1
Roy and Juana went to Arad,Roy didn't go to Arad,1
Kevin created a muscular and ugly work of art, Kevin didn't create a thankful work of art,0
Christina created an aggressive and shy work of art, Vivian didn't create a shy work of art,0
Andrea got me lying and heard my voice,Andrea didn't get me lying,1
Jonathan and Mildred have traveled to Arad,Ronnie didn't travel to Arad,0
Jeanette created a jealous and ashy work of art, Jeanette didn't create a jealous work of art,1
John is kind and Betty is shy, Betty is not kind,0
Gabriel went to Turda and Baia Mare,Gabriel didn't go to Baia Mare,1
"Colleen, who is a pilot, bought a Macbook","Colleen, who is a painter, didn't buy a Macbook",0
Joanna and Virgil have traveled to Dej,Pamela didn't travel to Dej,0
Pearl has visited Cluj-Napoca and Slatina,Rachel didn't visit Cluj-Napoca,0
Milton is polite and Louise is lively, Milton is not polite,1
Marcia created a mango and handsome work of art, Marcia didn't create a mango work of art,1
"Neil, who is a photographer, saw a girl running","Neil, William's father, didn't saw a girl running",0
Chris and Terry went to Blaj,Chris didn't go to Blaj,1
Peggy read the news and saw Kenneth,Peggy didn't see Kenneth,1
Doris had a salmon car and cut himself,Ruth didn't have a salmon car,0
Ramona spoke to me and read the news,Ramona didn't pay her,0
Maggie created a skinny and mushy work of art, Maggie didn't create a skinny work of art,1
George drank an orange juice and took the salmon shirt out of the washer,Nellie didn't take the salmon shirt out of the washer,0
Charlotte created an important and alive work of art, Charlotte didn't create a thoughtless work of art,0
Jack and Zachary have visited Bucharest,Brian didn't visit Bucharest,0
Marilyn paid me and read the book about spiders,Marilyn didn't read the book about spiders,1
Julia is easy and Michelle is inexpensive, Michelle is not inexpensive,1
Peter brought me out of Emily's house and lent me some money a month before,Peter didn't leave me,0
Alicia blew me off and stood up to Terrence,Alicia didn't blow me off,1
Sandra is agreeable and Angela is obedient, Sandra is not agreeable,1
Joseph is delightful and Guadalupe is agreeable, Becky is wrong,0
Andre is nice and Kay is powerful, Andre is not powerful,0
Andre is brave and Juanita is ambitious, Tyler is powerful,0
Gary and Theresa went to Bucharest,Gary didn't go to Bucharest,1
Marcia created a bald and ugly work of art, Violet didn't create a bald work of art,0
Julio and Priscilla went to Giurgiu,Julio didn't go to Giurgiu,1
Lindsay and Walter went to Cluj-Napoca,Leo didn't go to Cluj-Napoca,0
Francis has visited Baia Mare and Tulcea,Francis didn't visit Baia Mare,1
Julie is lively and Helen is thankful, Bonnie is not hallowed,0
Ronnie is calm and Connie is alive, Connie is not calm,0
Shelley is ambitious and Gladys is jolly, Cody is helpful,0
Francis went to Cluj-Napoca and Cluj-Napoca,Ruth didn't go to Cluj-Napoca,0
"Martin, who is a fireman, visit Sherry",Martin isn't a fireman,1
Phyllis has visited Tulcea and Hunedoara,Debra didn't visit Hunedoara,0
Patrick created a delightful and worried work of art, Patrick didn't create a delightful work of art,1
Max is kind and Anne is nice, Max is not kind,1
Jenny has visited Vaslui and Lugoj,Jenny didn't visit Lugoj,1
Mario created a plain and grumpy work of art, Mario didn't create a plain work of art,1
Daisy is alive and Shane is vast, Shane is not vast,1
Grace made coffee and dreamed of the playing with Terry,Grace didn't make coffee,1
Allen has visited Slobozia and Cluj-Napoca,Allen didn't visit Slobozia,1
Verna has traveled to Slatina and Blaj,Joan didn't travel to Slatina,0
Sylvia created a repulsive and jealous work of art, Sylvia didn't create a repulsive work of art,1
Tara created an elegant and pitiful work of art, Tara didn't create a beautiful work of art,0
Heather created a yellow and purple work of art, Heather didn't create a dazzling work of art,0
Sonia is powerful and Pedro is wrong, Pedro is not wrong,1
Nathan and Sharon went to Slobozia,Sharon didn't go to Arad,0
Florence is witty and Nathaniel is helpful, Nathaniel is not witty,0
Tyler created an odd and gorgeous work of art, Gabriel didn't create a gorgeous work of art,0
Joyce is faithful and Craig is proud, Marlene is not mushy,0
Ronnie is gentle and Patsy is alive, Patsy is not gentle,0
Minnie created a beautiful and angry work of art, Micheal didn't create an angry work of art,0
Nancy and Melvin have traveled to Slobozia,Melvin didn't travel to Slobozia,1
Roberto forgot about Harry's past and threw everything out the window,Roberto didn't forget about Harry's past,1
Jeffery created a nervous and stocky work of art, Jeffery didn't create a nervous work of art,1
Cathy created an itchy and shapely work of art, Nicole didn't create an itchy work of art,0
Alvin began screaming and slept for eight hours,Alvin didn't sleep for eight hours,1
Adam is proud and Katrina is witty, Andrew is not unimportant,0
Violet said funny things and led me to Guy's house,Victoria didn't say funny things,0
Peggy saw a girl driving Tracy's new Tesla Roadster,Peggy didn't saw a girl driving in Mangalia,0
Jeffery ran from Barcelona to Mangalia and bet on the game,Eric didn't bet on the game,0
Antonio created a powerful and muscular work of art, Antonio didn't create a powerful work of art,1
Kirk created a clever and clumsy work of art, Joy didn't create a clumsy work of art,0
Maria created a lively and bald work of art, Maria didn't create a lively work of art,1
Tara has visited Mangalia and Cluj-Napoca,Tara didn't visit Mangalia,1
Lucille created a lazy and calm work of art, Lucille didn't create a lazy work of art,1
Tyrone went to Mangalia and Slatina,Tyrone didn't go to Bucharest,0
Calvin went to Craiova and Timisoara,Calvin didn't go to Timisoara,1
Lee is eager and Ivan is famous, Ivan is not eager,0
Gloria created an ashy and clever work of art, Cora didn't create a clever work of art,0
Genevieve is eager and Tracey is silly, Genevieve is not eager,1
Heidi is nice and Catherine is clever, Heidi is not clever,0
April and Jeff have traveled to Slobozia,Jeff didn't travel to Slobozia,1
Franklin is thankful and Anita is polite, Franklin is not thankful,1
Kurt is zealous and Harriet is famous, Kurt is not famous,0
Jeffrey and Sara went to Lugoj,Sara didn't go to Lugoj,1
Troy has visited Vaslui and Arad,Roland didn't visit Vaslui,0
Brandy and Glenda have visited Baia Mare,Antonio didn't visit Baia Mare,0
Daisy created a defeated and obedient work of art, Daisy didn't create a delightful work of art,0
Erin created a kind and jolly work of art, Jacob didn't create a jolly work of art,0
Ida and Mario have traveled to Cluj-Napoca,Ida didn't travel to Turda,0
Barbara has traveled to Deva and Slobozia,Barbara didn't travel to Slobozia,1
Tonya shut the door down and forgot about Margaret's past,Inez didn't shut the door down,0
Ethel saw a boy driving in Mangalia,Ethel didn't saw a boy driving a orange car,0
"Megan, who is a electrician, saw the new Marvel movie from the Russo Brothers",Megan didn't saw the new Marvel movie from the Russo Brothers,1
Rachel and Lola have traveled to Reghin,Dustin didn't travel to Reghin,0
Bob is lively and Jim is unimportant, Jim is not lively,0
Edith held me back and won the soccer match,Edith didn't hear my voice,0
Paul and Ella have traveled to Blaj,Paul didn't travel to Blaj,1
Theresa sent me a letter and broke Jeffery's heart,Theresa didn't take office,0
Dorothy built a computer and showed my new photos,Dorothy didn't show my new photos,1
Debra created a red and shy work of art, Debra didn't create a red work of art,1
"Glenda, who is a bartender, bought a japanese novel",Glenda didn't buy a japanese novel,1
Marian and Lula have visited Baia Mare,Lula didn't visit Baia Mare,1
Elizabeth saw Nathaniel running from Norma's car,Elizabeth didn't saw Nathaniel running from a gray school bus,0
"Anthony, who is a photographer, bought a pizza","Anthony, who is a nurse, didn't buy a pizza",0
Adrian is lively and Phyllis is tender, Adrian is not tender,0
Bertha rode the horse and said nice things,Bertha didn't ride the horse,1
Isabel has traveled to Arad and Turda,Isabel didn't travel to Arad,1
Bonnie created a fierce and important work of art, Bonnie didn't create an orange work of art,0
Ana is happy and Timothy is hallowed, Timothy is not happy,0
Barry created a scary and powerful work of art, Barry didn't create an icy work of art,0
Willie created a handsome and fancy work of art, Willie didn't create a handsome work of art,1
Laura has visited Blaj and Slobozia,Laura didn't visit Baia Mare,0
Maureen kept Byron's secret from me and fell off,Maureen didn't fall off,1
Ruben has traveled to Slobozia and Dej,Ruben didn't travel to Slobozia,1
Jeremy went to Craiova and Bucharest,Jeremy didn't go to Craiova,1
Eduardo is zealous and Jacob is ambitious, Eduardo is not zealous,1
Constance found her and knew about us,Constance didn't find her,1
Ben is brave and Jane is faithful, Ben is not brave,1
Sandy and Connie have visited Blaj,Seth didn't visit Blaj,0
Lisa fought Juan and kept the game alive,Carol didn't keep the game alive,0
Cory and Jesus went to Baia Mare,Cory didn't go to Baia Mare,1
Clifford and Clara went to Craiova,Inez didn't go to Craiova,0
Barbara is polite and Barry is jolly, Barbara is not polite,1
Penny created an alive and delightful work of art, Penny didn't create an alive work of art,1
Peter left me and sang a nice song,Jesse didn't sing a nice song,0
Rose created a scary and ugly work of art, Mildred didn't create an ugly work of art,0
David created a thoughtless and unkempt work of art, Barry didn't create an unkempt work of art,0
Travis is thankful and Laurie is calm, Travis is not thankful,1
Myrtle is happy and Marvin is aggressive, Myrtle is not happy,1
Edwin and Jamie went to Turda,Eduardo didn't go to Turda,0
Jeremy created a proud and lemon work of art, Jeremy didn't create a proud work of art,1
Wanda created a purple and happy work of art, Leon didn't create a purple work of art,0
Rebecca said funny things and kept Irene's secret from me,Rebecca didn't wear a red jacket,0
Marguerite saw Albert driving an electric yellow bicycle,Marguerite didn't saw Albert driving,1
Frank is vast and Mabel is mushy, Mabel is not mushy,1
Cheryl is victorious and Kristina is proud, Cheryl is not victorious,1
Arnold has traveled to Dej and Slobozia,Arnold didn't travel to Slobozia,1
Penny went to Arad and Mangalia,Penny didn't go to Arad,1
Lucille saw a boy running from Gloria's car,Lucille didn't saw a boy running,1
Wanda has visited Craiova and Mangalia,Sheryl didn't visit Mangalia,0
Jesus is nice and Luis is obedient, Tim is not tender,0
Carole created an attractive and gifted work of art, Lindsay didn't create an attractive work of art,0
"Alexander, who is a nurse, saw the car crash",Alexander didn't saw the car crash,1
Opal created a wrong and pitiful work of art, Opal didn't create a wrong work of art,1
Philip has visited Bucharest and Oradea,Philip didn't visit Oradea,1
Jerry found what I was looking for and thought Jaime was going to die,Wayne didn't find what I was looking for,0
Mario is agreeable and Helen is powerful, Helen is not agreeable,0
"Misty, who is a hairdresser, saw the city mayor","Misty, who is a builder, didn't saw the city mayor",0
Lonnie created an unsightly and better work of art, Lonnie didn't create a powerful work of art,0
Wesley went to Timisoara and Slatina,Shirley didn't go to Slatina,0
Bryan went to Hunedoara and Cluj-Napoca,Bryan didn't go to Cluj-Napoca,1
"Seth, who is a barber, saw the new Tesla Roadster","Seth, Cecil's father, didn't saw the new Tesla Roadster",0
Kathleen is inexpensive and Jamie is gifted, Jamie is not gifted,1
Lillie found what I was looking for and wrote me an email,Lillie didn't find what I was looking for,1
Ricky has visited Baia Mare and Arad,Ricky didn't visit Baia Mare,1
